<?xml version="1.0" encoding="UTF-8"?>
<list enabled="true" xmlns:xsi="http://www.w3.org/2001/XMLSchema-instance" xsi:noNamespaceSchemaLocation="xsd/LimitShop.xsd">
	<!--
		Classic 447 L-Coin Store catalog.

		These product IDs are the records shipped by the active
		LCoinShopProduct_Classic-eu.dat. Products 10069 and 10070 remain
		excluded because their rewards (99041 and 99042) are not defined by
		the server datapack.
	-->

	<!-- Category 0: featured products. -->
	<product id="10001" category="0">
		<ingredient id="91663" count="1000" /> <!-- L-Coin -->
		<production id="92020" /> <!-- Enchant Kit: Talisman of Eva -->
	</product>
	<product id="10002" category="0">
		<ingredient id="91663" count="800" /> <!-- L-Coin -->
		<production id="91767" /> <!-- Enchant Kit: Talisman of Aden -->
	</product>
	<product id="10060" category="0">
		<ingredient id="92314" count="50" /> <!-- Giran Seal -->
		<production id="94214" /> <!-- Mark of Maestro (Time-limited) -->
	</product>

	<!-- Category 1: enhancement. -->
	<product id="10021" category="1">
		<ingredient id="91663" count="800" /> <!-- L-Coin -->
		<production id="91032" /> <!-- Fire Spirit Evolution Stone -->
	</product>
	<product id="10022" category="1">
		<ingredient id="91663" count="800" /> <!-- L-Coin -->
		<production id="91033" /> <!-- Wind Spirit Evolution Stone -->
	</product>
	<product id="10023" category="1">
		<ingredient id="91663" count="800" /> <!-- L-Coin -->
		<production id="91034" /> <!-- Earth Spirit Evolution Stone -->
	</product>
	<product id="10024" category="1">
		<ingredient id="91663" count="800" /> <!-- L-Coin -->
		<production id="91031" /> <!-- Water Spirit Evolution Stone -->
	</product>
	<product id="10061" category="1">
		<ingredient id="92314" count="80" /> <!-- Giran Seal -->
		<production id="22223" /> <!-- Stable Scroll: Enchant A-grade Weapon -->
	</product>
	<product id="10062" category="1">
		<ingredient id="92314" count="40" /> <!-- Giran Seal -->
		<production id="49486" /> <!-- Stable Scroll: Enchant B-grade Weapon -->
	</product>
	<product id="10063" category="1">
		<ingredient id="92314" count="40" /> <!-- Giran Seal -->
		<production id="22224" /> <!-- Stable Scroll: Enchant A-grade Armor -->
	</product>
	<product id="10064" category="1">
		<ingredient id="92314" count="20" /> <!-- Giran Seal -->
		<production id="49485" /> <!-- Stable Scroll: Enchant B-grade Armor -->
	</product>

	<!-- Category 2: consumables. -->
	<product id="10012" category="2">
		<ingredient id="91663" count="300" /> <!-- L-Coin -->
		<production id="90404" /> <!-- My Teleport Book -->
	</product>
	<product id="10013" category="2">
		<ingredient id="91663" count="20" /> <!-- L-Coin -->
		<production id="90405" /> <!-- My Teleport Scroll -->
	</product>
	<product id="10014" category="2">
		<ingredient id="91663" count="20" /> <!-- L-Coin -->
		<production id="91689" /> <!-- Blessed Scroll of Escape -->
	</product>
	<product id="10042" category="2">
		<ingredient id="91663" count="50" /> <!-- L-Coin -->
		<production id="90519" /> <!-- Shining Scroll of Mood Melody -->
	</product>
	<product id="10043" category="2">
		<ingredient id="91663" count="100" /> <!-- L-Coin -->
		<production id="90183" /> <!-- Chef's Fish Stew - Victory -->
	</product>
	<product id="10044" category="2">
		<ingredient id="91663" count="350" /> <!-- L-Coin -->
		<production id="49081" /> <!-- XP Growth Scroll -->
	</product>
	<product id="10011" category="2">
		<ingredient id="91663" count="20" /> <!-- L-Coin -->
		<production id="91641" /> <!-- Sayha's Blessing -->
	</product>

	<!-- Category 3: permanent utility. -->
	<product id="10018" category="3">
		<ingredient id="92314" count="10" /> <!-- Giran Seal -->
		<production id="92006" /> <!-- Inventory Expansion Ticket Lv.3 -->
	</product>
	<product id="10019" category="3">
		<ingredient id="92314" count="20" /> <!-- Giran Seal -->
		<production id="92007" /> <!-- Inventory Expansion Ticket Lv.4 -->
	</product>
	<product id="10020" category="3">
		<ingredient id="92314" count="40" /> <!-- Giran Seal -->
		<production id="92008" /> <!-- Inventory Expansion Ticket Lv.5 -->
	</product>
	<product id="10025" category="3">
		<ingredient id="57" count="5000000" /> <!-- Adena -->
		<production id="32253" /> <!-- Infinite Mithril Quiver -->
	</product>
	<product id="10026" category="3">
		<ingredient id="57" count="3000000" /> <!-- Adena -->
		<production id="32252" /> <!-- Infinite Silver Quiver -->
	</product>
	<product id="10027" category="3">
		<ingredient id="57" count="2000000" /> <!-- Adena -->
		<production id="32251" /> <!-- Infinite Steel Quiver -->
	</product>
	<product id="10028" category="3">
		<ingredient id="57" count="1000000" /> <!-- Adena -->
		<production id="32250" /> <!-- Infinite Bone Quiver -->
	</product>
	<product id="10065" category="3">
		<ingredient id="92314" count="100" /> <!-- Giran Seal -->
		<production id="32254" /> <!-- Infinite Quiver of Light -->
	</product>

	<!-- Category 4: limited progression. -->
	<product id="10016" category="4">
		<ingredient id="92314" count="2" /> <!-- Giran Seal -->
		<production id="92004" /> <!-- Inventory Expansion Ticket Lv.1 -->
	</product>
	<product id="10017" category="4">
		<ingredient id="92314" count="5" /> <!-- Giran Seal -->
		<production id="92005" /> <!-- Inventory Expansion Ticket Lv.2 -->
	</product>
	<product id="10035" category="4">
		<ingredient id="91663" count="20" /> <!-- L-Coin -->
		<production id="91641" accountDailyLimit="20" /> <!-- Sayha's Blessing -->
	</product>
	<product id="10066" category="4">
		<ingredient id="91663" count="1000" /> <!-- L-Coin -->
		<production id="92020" accountDailyLimit="1" /> <!-- Enchant Kit: Talisman of Eva -->
	</product>
	<product id="10067" category="4">
		<ingredient id="91663" count="800" /> <!-- L-Coin -->
		<production id="91767" accountDailyLimit="1" /> <!-- Enchant Kit: Talisman of Aden -->
	</product>
	<product id="10068" category="4">
		<ingredient id="92314" count="25" /> <!-- Giran Seal -->
		<production id="94208" accountDailyLimit="1" /> <!-- Scroll of Blessing -->
	</product>
	<product id="10071" category="4">
		<ingredient id="91663" count="100" /> <!-- L-Coin -->
		<production id="94377" accountDailyLimit="10" /> <!-- Supply Pouch -->
	</product>
	<product id="10073" category="4">
		<ingredient id="57" count="5000000" /> <!-- Adena -->
		<production id="94781" accountBuyLimit="2" /> <!-- Growth Rune Lv.1 -->
	</product>
	<product id="10074" category="4">
		<ingredient id="57" count="1000000" /> <!-- Adena -->
		<production id="94780" accountDailyLimit="100" /> <!-- Growth Rune Fragment -->
	</product>
	<product id="10124" category="4">
		<ingredient id="92314" count="15" /> <!-- Giran Seal -->
		<production id="93406" accountDailyLimit="5" /> <!-- Scroll: Enchant B-grade Weapon -->
	</product>
	<product id="10125" category="4">
		<ingredient id="92314" count="10" /> <!-- Giran Seal -->
		<production id="93407" accountDailyLimit="5" /> <!-- Scroll: Enchant B-grade Armor -->
	</product>
	<product id="10126" category="4">
		<ingredient id="92314" count="8" /> <!-- Giran Seal -->
		<production id="93408" accountDailyLimit="5" /> <!-- Scroll: Enchant C-grade Weapon -->
	</product>
	<product id="10127" category="4">
		<ingredient id="92314" count="5" /> <!-- Giran Seal -->
		<production id="93409" accountDailyLimit="5" /> <!-- Scroll: Enchant C-grade Armor -->
	</product>
	<product id="10128" category="4">
		<ingredient id="92314" count="3" /> <!-- Giran Seal -->
		<production id="93410" accountDailyLimit="5" /> <!-- Scroll: Enchant D-grade Weapon -->
	</product>
	<product id="10129" category="4">
		<ingredient id="92314" count="2" /> <!-- Giran Seal -->
		<production id="93411" accountDailyLimit="5" /> <!-- Scroll: Enchant D-grade Armor -->
	</product>
</list>
